{
  "$schema": "./component.schema.json",
  "id": "card",
  "purpose": "Groups related content and actions on a distinct surface, e.g. a plan option, an order summary, or a settings section.",
  "variants": [
    { "name": "default", "usage": "Neutral content grouping.", "tokens": ["color.surface.card", "shadow.sm", "radius.lg", "space.6"] },
    { "name": "selectable", "usage": "One-of-many choice (e.g. subscription plans); selection state must not rely on color alone.", "tokens": ["color.surface.card", "color.border.focus", "radius.lg"] },
    { "name": "summary", "usage": "Read-only recap of user input before a final commit (checkout review, upgrade review).", "tokens": ["color.surface.card", "shadow.sm", "radius.lg"] }
  ],
  "props": [
    { "name": "title", "type": "string", "required": true, "description": "Card heading; rendered as a section heading for AT navigation." },
    { "name": "variant", "type": "string", "required": false, "enum": ["default", "selectable", "summary"], "default": "default" },
    { "name": "children", "type": "Node[]", "required": true, "description": "Card body content (AST nodes)." },
    { "name": "selected", "type": "boolean", "required": false, "description": "Selection state for the selectable variant." }
  ],
  "accessibility": [
    { "id": "a11y-card-heading", "requirement": "Card title renders as a real heading element in the document outline.", "wcag": "1.3.1" },
    { "id": "a11y-card-selectable", "requirement": "Selectable cards expose selection via a real input (radio), not just styling.", "wcag": "4.1.2" }
  ],
  "constraints": [
    { "id": "c-card-title", "rule": "title is mandatory; anonymous surfaces are not allowed.", "machineCheck": "card-has-title" },
    { "id": "c-card-nesting", "rule": "Cards must not nest more than one level deep." }
  ],
  "examples": [
    {
      "title": "Order summary card",
      "ast": {
        "type": "Card",
        "title": "Order summary",
        "variant": "summary",
        "children": [{ "type": "Text", "role": "body", "content": "Pro plan - 12 EUR / month" }]
      }
    }
  ]
}
